{
  "schemaVersion": 1,
  "workTypeCode": "TEMP",
  "updatedAt": "2026-09-17",
  "hazards": [
    {
      "id": "HZ-TEMP-001",
      "task": "비계 조립·해체",
      "hazard": "조립 중 작업발판 미설치 구간에서 떨어짐",
      "accidentTypes": ["FALL"],
      "controls": [
        { "type": "ENG", "text": "조립 순서에 따라 작업발판을 선행 설치하고 안전난간 동시 설치" },
        { "type": "ENG", "text": "추락방호망 설치 또는 안전대 부착설비 선행 설치" },
        { "type": "ADMIN", "text": "조립도에 따라 작업하고 작업지휘자 배치" },
        { "type": "PPE", "text": "안전대 착용 및 상시 체결" }
      ],
      "legalBasis": ["산업안전보건기준에 관한 규칙 제42조(추락의 방지)", "같은 규칙 제44조(안전대의 부착설비 등)", "같은 규칙 제57조(비계 조립·해체 및 변경)", "같은 규칙 제58조(비계의 점검 및 보수)"],
      "legalBasisVerified": false,
      "severityDefault": 3,
      "likelihoodDefault": 3,
      "checkItems": ["작업발판 선행 설치 여부", "안전난간 설치", "안전대 체결", "조립도 비치"],
      "keywords": ["비계", "조립", "추락"]
    },
    {
      "id": "HZ-TEMP-002",
      "task": "비계 사용",
      "hazard": "작업발판 폭 부족·틈새 과다·고정 불량으로 발판이 흔들리거나 탈락",
      "accidentTypes": ["FALL"],
      "controls": [
        { "type": "ENG", "text": "작업발판 폭 40cm 이상, 틈 3cm 이하 확보 및 2개소 이상 고정" },
        { "type": "ADMIN", "text": "매일 작업 시작 전 발판 상태 점검" }
      ],
      "legalBasis": ["산업안전보건기준에 관한 규칙 제56조(작업발판의 구조)", "같은 규칙 제35조제2항 및 별표 3(작업시작 전 점검사항)"],
      "legalBasisVerified": false,
      "severityDefault": 3,
      "likelihoodDefault": 2,
      "checkItems": ["발판 폭", "발판 틈", "고정 상태", "돌출부 유무"],
      "keywords": ["작업발판", "비계", "폭"]
    },
    {
      "id": "HZ-TEMP-003",
      "task": "비계 사용",
      "hazard": "안전난간 미설치 또는 임의 해체 후 미복구 상태에서 작업",
      "accidentTypes": ["FALL"],
      "controls": [
        { "type": "ENG", "text": "상부난간대·중간난간대·발끝막이판을 규격대로 설치" },
        { "type": "ADMIN", "text": "자재 반입 등으로 해체 시 즉시 복구 및 해체구간 표시·감시" }
      ],
      "legalBasis": ["산업안전보건기준에 관한 규칙 제13조(안전난간의 구조 및 설치요건)", "같은 규칙 제42조(추락의 방지)"],
      "legalBasisVerified": false,
      "severityDefault": 3,
      "likelihoodDefault": 2,
      "checkItems": ["상·중간 난간대 설치", "발끝막이판", "임의 해체 구간"],
      "keywords": ["안전난간", "발끝막이판"]
    },
    {
      "id": "HZ-TEMP-004",
      "task": "비계 설치",
      "hazard": "벽이음·버팀대 부족 또는 기초 침하로 비계 전체가 무너짐",
      "accidentTypes": ["COLLAPSE"],
      "controls": [
        { "type": "ENG", "text": "벽이음을 규정 간격으로 설치하고 기초에 깔판·받침철물 설치" },
        { "type": "ADMIN", "text": "강풍·강우 후 비계 점검 실시 후 사용" }
      ],
      "legalBasis": ["산업안전보건기준에 관한 규칙 제59조(강관비계 조립 시의 준수사항)", "같은 규칙 제60조(강관비계의 구조)", "같은 규칙 제58조(비계의 점검 및 보수)"],
      "legalBasisVerified": false,
      "severityDefault": 3,
      "likelihoodDefault": 2,
      "checkItems": ["벽이음 간격", "기초 침하", "가새 설치"],
      "keywords": ["벽이음", "비계붕괴", "침하"]
    },
    {
      "id": "HZ-TEMP-005",
      "task": "이동식비계 사용",
      "hazard": "작업자가 탑승한 채 비계를 이동하거나 바퀴 미고정으로 전도",
      "accidentTypes": ["FALL", "COLLAPSE"],
      "controls": [
        { "type": "ENG", "text": "아웃트리거 설치 및 바퀴 브레이크 고정" },
        { "type": "ADMIN", "text": "탑승 상태 이동 금지, 이동 시 전원 하차" }
      ],
      "legalBasis": ["산업안전보건기준에 관한 규칙 제68조(이동식비계)", "같은 규칙 제86조(탑승의 제한)"],
      "legalBasisVerified": false,
      "severityDefault": 3,
      "likelihoodDefault": 2,
      "checkItems": ["아웃트리거", "바퀴 고정", "탑승 이동 여부", "최대적재하중 표시"],
      "keywords": ["이동식비계", "아웃트리거", "전도"]
    },
    {
      "id": "HZ-TEMP-006",
      "task": "사다리 작업",
      "hazard": "사다리 상부에서 몸을 기울여 작업하다 균형을 잃고 떨어짐",
      "accidentTypes": ["FALL"],
      "controls": [
        { "type": "SUBST", "text": "가능한 경우 사다리 대신 비계·고소작업대 사용" },
        { "type": "ENG", "text": "사다리 상부·하부 고정 및 미끄럼 방지" },
        { "type": "ADMIN", "text": "2인 1조 작업, 최상부 디딤대 작업 금지" }
      ],
      "legalBasis": ["산업안전보건기준에 관한 규칙 제24조(사다리식 통로 등의 구조)", "같은 규칙 제42조(추락의 방지)"],
      "legalBasisVerified": false,
      "severityDefault": 3,
      "likelihoodDefault": 3,
      "checkItems": ["사다리 고정", "설치 각도", "2인 1조 여부"],
      "keywords": ["사다리", "추락", "A형사다리"]
    },
    {
      "id": "HZ-TEMP-007",
      "task": "말비계 작업",
      "hazard": "말비계 위에서 이동 중 발판 밖으로 떨어짐",
      "accidentTypes": ["FALL"],
      "controls": [
        { "type": "ENG", "text": "지주부재 하단 미끄럼방지장치 설치, 발판 폭 40cm 이상 확보" },
        { "type": "ADMIN", "text": "높이 2m 초과 시 사용 제한" }
      ],
      "legalBasis": ["산업안전보건기준에 관한 규칙 제67조(말비계)"],
      "legalBasisVerified": false,
      "severityDefault": 2,
      "likelihoodDefault": 2,
      "checkItems": ["미끄럼방지장치", "발판 폭", "설치 높이"],
      "keywords": ["말비계", "우마"]
    },
    {
      "id": "HZ-TEMP-008",
      "task": "달비계 작업",
      "hazard": "달비계 로프 손상·결속 불량으로 작업대가 추락",
      "accidentTypes": ["FALL"],
      "controls": [
        { "type": "ENG", "text": "작업용 로프와 별도로 구명줄을 설치하고 각각 다른 지점에 고정" },
        { "type": "ADMIN", "text": "작업 전 로프 손상·마모 점검 및 결속 상태 확인" },
        { "type": "PPE", "text": "구명줄에 안전대 체결" }
      ],
      "legalBasis": ["산업안전보건기준에 관한 규칙 제63조(달비계의 구조)", "같은 규칙 제42조(추락의 방지)"],
      "legalBasisVerified": false,
      "severityDefault": 3,
      "likelihoodDefault": 2,
      "checkItems": ["구명줄 별도 설치", "로프 손상", "고정지점 건전성"],
      "keywords": ["달비계", "로프", "구명줄"]
    },
    {
      "id": "HZ-TEMP-009",
      "task": "개구부 주변 작업",
      "hazard": "슬래브 개구부·엘리베이터 피트에 덮개 미설치로 떨어짐",
      "accidentTypes": ["FALL"],
      "controls": [
        { "type": "ENG", "text": "개구부에 덮개 설치 후 고정하고 '개구부' 표시" },
        { "type": "ENG", "text": "덮개 설치가 곤란하면 안전난간 또는 추락방호망 설치" },
        { "type": "ADMIN", "text": "임의 개방 금지 및 개방 시 감시자 배치" }
      ],
      "legalBasis": ["산업안전보건기준에 관한 규칙 제43조(개구부 등의 방호 조치)"],
      "legalBasisVerified": false,
      "severityDefault": 3,
      "likelihoodDefault": 3,
      "checkItems": ["덮개 설치·고정", "표시", "임의 개방 여부"],
      "keywords": ["개구부", "덮개", "피트"]
    },
    {
      "id": "HZ-TEMP-010",
      "task": "가설통로 이용",
      "hazard": "경사로 미끄럼방지 미설치·난간 없음으로 넘어지거나 떨어짐",
      "accidentTypes": ["SLIP", "FALL"],
      "controls": [
        { "type": "ENG", "text": "경사 30도 초과 시 미끄럼방지 발판 설치, 추락위험 구간 난간 설치" },
        { "type": "ADMIN", "text": "지정 통로 외 이동 금지" }
      ],
      "legalBasis": ["산업안전보건기준에 관한 규칙 제23조(가설통로의 구조)"],
      "legalBasisVerified": false,
      "severityDefault": 2,
      "likelihoodDefault": 2,
      "checkItems": ["경사도", "미끄럼방지", "난간 설치"],
      "keywords": ["가설통로", "경사로", "램프"]
    },
    {
      "id": "HZ-TEMP-011",
      "task": "고소작업대(차량탑재형) 사용",
      "hazard": "과상승 방지장치 미작동·안전대 미체결 상태에서 작업 중 끼임 또는 추락",
      "accidentTypes": ["CAUGHT", "FALL"],
      "controls": [
        { "type": "ENG", "text": "과상승방지봉 및 비상하강장치 작동 확인" },
        { "type": "ADMIN", "text": "아웃트리거 전개 후 작업, 정격하중 준수" },
        { "type": "PPE", "text": "작업대 내 안전대 체결" }
      ],
      "legalBasis": ["산업안전보건기준에 관한 규칙 제186조(고소작업대 설치 등의 조치)"],
      "legalBasisVerified": false,
      "severityDefault": 3,
      "likelihoodDefault": 2,
      "checkItems": ["과상승방지장치", "아웃트리거", "안전대 체결", "정격하중"],
      "keywords": ["고소작업대", "스카이", "과상승"]
    },
    {
      "id": "HZ-TEMP-012",
      "task": "가설자재 하역·적치",
      "hazard": "적치 높이 과다·결속 불량으로 자재가 무너져 깔림",
      "accidentTypes": ["COLLAPSE", "HIT"],
      "controls": [
        { "type": "ENG", "text": "받침목 설치 및 적치 높이 제한, 결속 실시" },
        { "type": "ADMIN", "text": "적치구역 지정 및 하중 검토" }
      ],
      "legalBasis": ["산업안전보건기준에 관한 규칙 제173조(화물적재 시의 조치)", "같은 규칙 제55조(작업발판의 최대적재하중)"],
      "legalBasisVerified": false,
      "severityDefault": 3,
      "likelihoodDefault": 2,
      "checkItems": ["적치 높이", "받침목", "결속 상태"],
      "keywords": ["적치", "자재붕괴", "결속"]
    }
  ]
}
