{
  "schemaVersion": 1,
  "workTypeCode": "MACH",
  "updatedAt": "2026-09-17",
  "hazards": [
    {
      "id": "HZ-MACH-001",
      "task": "차량계 건설기계 운행",
      "hazard": "연약지반·경사지에서 장비가 전도·전락",
      "accidentTypes": ["ROLLOVER"],
      "controls": [
        { "type": "ENG", "text": "운행경로 지반 다짐 및 노폭 확보, 갓길 붕괴 방지 조치" },
        { "type": "ADMIN", "text": "작업계획서에 운행경로·작업방법 명시 후 주지" },
        { "type": "PPE", "text": "전도 시 대비 좌석안전띠 착용" }
      ],
      "legalBasis": ["산업안전보건기준에 관한 규칙 제199조(전도 등의 방지)", "같은 규칙 제172조(갓길의 붕괴 방지)", "같은 규칙 제38조(사전조사 및 작업계획서의 작성)"],
      "legalBasisVerified": false,
      "severityDefault": 3,
      "likelihoodDefault": 2,
      "checkItems": ["노폭·지반 상태", "운행경로 주지", "안전띠 착용"],
      "keywords": ["전도", "전락", "갓길"]
    },
    {
      "id": "HZ-MACH-002",
      "task": "굴착기 부착물 교체",
      "hazard": "퀵커플러 잠금 불량으로 버킷·브레이커가 탈락",
      "accidentTypes": ["HIT"],
      "controls": [
        { "type": "ENG", "text": "안전핀 체결 및 이중잠금 확인" },
        { "type": "ADMIN", "text": "교체 후 지면에서 하중시험 실시, 하부 접근 금지" }
      ],
      "legalBasis": ["산업안전보건기준에 관한 규칙 제204조(주용도 외의 사용 제한)", "같은 규칙 제205조(붐 등의 강하에 의한 위험 방지)"],
      "legalBasisVerified": false,
      "severityDefault": 3,
      "likelihoodDefault": 2,
      "checkItems": ["안전핀 체결", "이중잠금", "하중시험"],
      "keywords": ["퀵커플러", "버킷", "탈락"]
    },
    {
      "id": "HZ-MACH-003",
      "task": "건설기계 정비",
      "hazard": "붐·암을 올린 상태에서 하부 정비 중 유압 강하로 깔림",
      "accidentTypes": ["ROLLOVER", "CAUGHT"],
      "controls": [
        { "type": "ENG", "text": "안전지주·안전블록 설치 후 정비" },
        { "type": "ADMIN", "text": "시동 정지·키 분리 및 정비 중 표지 부착" }
      ],
      "legalBasis": ["산업안전보건기준에 관한 규칙 제205조(붐 등의 강하에 의한 위험 방지)", "같은 규칙 제206조(수리 등의 작업 시 조치)", "같은 규칙 제92조(정비 등의 작업 시의 운전정지 등)"],
      "legalBasisVerified": false,
      "severityDefault": 3,
      "likelihoodDefault": 2,
      "checkItems": ["안전지주 설치", "시동 정지", "정비중 표지"],
      "keywords": ["정비", "안전블록", "유압강하"]
    },
    {
      "id": "HZ-MACH-004",
      "task": "건설기계 운전",
      "hazard": "운전위치 이탈 시 조치 미실시로 장비가 불시 이동",
      "accidentTypes": ["STRIKE", "ROLLOVER"],
      "controls": [
        { "type": "ADMIN", "text": "버킷을 지면에 내리고 시동 정지, 브레이크 체결 후 이탈" },
        { "type": "ENG", "text": "경사지 주차 시 고임목 설치" }
      ],
      "legalBasis": ["산업안전보건기준에 관한 규칙 제99조(운전위치 이탈 시의 조치)", "같은 규칙 제200조(운전위치 이탈 시의 조치)"],
      "legalBasisVerified": false,
      "severityDefault": 3,
      "likelihoodDefault": 2,
      "checkItems": ["버킷 하강", "시동 정지", "고임목"],
      "keywords": ["운전이탈", "고임목", "불시이동"]
    },
    {
      "id": "HZ-MACH-005",
      "task": "건설기계 탑승",
      "hazard": "버킷·적재함 등 승차석 외 탑승으로 추락",
      "accidentTypes": ["FALL"],
      "controls": [
        { "type": "ADMIN", "text": "승차석 외 탑승 금지 및 위반 시 작업 중지" },
        { "type": "SUBST", "text": "인원 이동은 지정된 승강설비·차량 이용" }
      ],
      "legalBasis": ["산업안전보건기준에 관한 규칙 제86조(탑승의 제한)", "같은 규칙 제202조(승차석 외의 탑승제한)"],
      "legalBasisVerified": false,
      "severityDefault": 3,
      "likelihoodDefault": 2,
      "checkItems": ["탑승 상태", "이동 수단"],
      "keywords": ["탑승제한", "버킷탑승"]
    },
    {
      "id": "HZ-MACH-006",
      "task": "항타기·항발기 작업",
      "hazard": "지반 침하 또는 권상용 와이어로프 손상으로 장비 전도·낙하",
      "accidentTypes": ["ROLLOVER", "HIT"],
      "controls": [
        { "type": "ENG", "text": "지반 보강 및 아웃트리거·받침 설치" },
        { "type": "ADMIN", "text": "와이어로프 점검 및 권상장치 제동장치 확인" },
        { "type": "ADMIN", "text": "조립·해체 시 작업지휘자 배치" }
      ],
      "legalBasis": ["산업안전보건기준에 관한 규칙 제207조(조립·해체 시 점검사항)", "같은 규칙 제209조(무너짐의 방지)", "같은 규칙 제210조(이음매가 있는 권상용 와이어로프의 사용 금지)"],
      "legalBasisVerified": false,
      "severityDefault": 3,
      "likelihoodDefault": 2,
      "checkItems": ["지반 보강", "와이어로프 상태", "작업지휘자"],
      "keywords": ["항타기", "파일", "전도"]
    },
    {
      "id": "HZ-MACH-007",
      "task": "지게차 운행",
      "hazard": "포크 상승 상태 주행·과적으로 전도, 후방 작업자 충돌",
      "accidentTypes": ["ROLLOVER", "STRIKE"],
      "controls": [
        { "type": "ADMIN", "text": "포크 하강 후 주행, 적재하중 준수" },
        { "type": "ENG", "text": "후방감지기·경광등 설치 및 보행자 통로 분리" },
        { "type": "PPE", "text": "좌석안전띠 착용" }
      ],
      "legalBasis": ["산업안전보건기준에 관한 규칙 제179조(전조등 등의 설치)", "같은 규칙 제180조(헤드가드)", "같은 규칙 제173조(화물적재 시의 조치)"],
      "legalBasisVerified": false,
      "severityDefault": 3,
      "likelihoodDefault": 2,
      "checkItems": ["포크 높이", "헤드가드", "후방감지기", "안전띠"],
      "keywords": ["지게차", "전도", "헤드가드"]
    },
    {
      "id": "HZ-MACH-008",
      "task": "건설기계 반입",
      "hazard": "트레일러 상하차 중 장비가 미끄러져 전락",
      "accidentTypes": ["ROLLOVER"],
      "controls": [
        { "type": "ENG", "text": "평탄한 장소에서 발판(도교) 충분한 길이·폭 확보 및 고정" },
        { "type": "ADMIN", "text": "유도자 배치 및 저속 주행" }
      ],
      "legalBasis": ["산업안전보건기준에 관한 규칙 제201조(차량계 건설기계의 이송)"],
      "legalBasisVerified": false,
      "severityDefault": 3,
      "likelihoodDefault": 2,
      "checkItems": ["발판 고정", "경사도", "유도자"],
      "keywords": ["상하차", "트레일러", "도교"]
    }
  ]
}
